{
  "id": "new-tool-id",
  "name": "New tool name",
  "summary": "What this tool is and why another team would reuse it.",
  "team": "team-id",
  "roles": ["designer", "engineer"],
  "risks": ["usability", "feasibility"],
  "dimensions": ["shared-tooling", "delivery-autonomy"],
  "handoffRemoved": "Describe the handoff or waiting state this removes.",
  "setup": {
    "type": "prompt",
    "content": "Paste the reusable prompt, setup instructions, or workflow here."
  },
  "limitations": "Describe what this does not solve or when not to use it.",
  "linkedPlays": [],
  "linkedExperiments": [],
  "adoptionCount": 0,
  "triedByTeams": []
}
